{
  "$schema": "https://json-schema.org/draft/2020-12/schema",
  "$id": "https://ki-lernplattform.local/schemas/exercise-family-cases.schema.json",
  "title": "Exercise family static cases",
  "type": "object",
  "additionalProperties": false,
  "required": ["schemaVersion", "familyId", "contract", "cases"],
  "properties": {
    "schemaVersion": { "const": 1 },
    "familyId": { "type": "string", "pattern": "^[a-z][a-z0-9]*(-[a-z0-9]+)*$" },
    "contract": {
      "anyOf": [
        { "$ref": "#/$defs/contract" },
        { "type": "null" }
      ]
    },
    "cases": {
      "type": "array",
      "minItems": 1,
      "items": { "$ref": "#/$defs/case" },
      "uniqueItems": true
    },
    "caseTitles": {
      "type": "object",
      "propertyNames": { "pattern": "^[a-z][a-z0-9]*(-[a-z0-9]+)*$" },
      "additionalProperties": { "type": "string", "minLength": 1 }
    }
  },
  "$defs": {
    "contract": {
      "type": "object",
      "additionalProperties": false,
      "required": [
        "familyId", "familyGroup", "summary", "taskArchetype", "authorityMode",
        "masteryEligible", "caseTypes", "difficultyProfiles", "competencyIds",
        "graderId", "activityType"
      ],
      "properties": {
        "familyId": { "type": "string", "pattern": "^[a-z][a-z0-9]*(-[a-z0-9]+)*$" },
        "familyGroup": { "type": "string", "pattern": "^[a-z][a-z0-9]*(-[a-z0-9]+)*$" },
        "summary": { "type": "string", "minLength": 1 },
        "taskArchetype": { "type": "string", "minLength": 1 },
        "authorityMode": { "enum": ["static"] },
        "masteryEligible": { "type": "boolean" },
        "caseTypes": {
          "type": "array",
          "minItems": 1,
          "items": {
            "type": "object",
            "additionalProperties": false,
            "required": ["caseId"],
            "properties": {
              "caseId": { "type": "string", "pattern": "^[a-z][a-z0-9]*(-[a-z0-9]+)*$" },
              "propertyTest": { "type": "boolean" }
            }
          }
        },
        "difficultyProfiles": {
          "type": "array",
          "minItems": 1,
          "uniqueItems": true,
          "items": { "enum": ["intro", "core", "stretch", "challenge"] }
        },
        "competencyIds": { "type": "array", "minItems": 1, "uniqueItems": true, "items": { "type": "string" } },
        "graderId": { "enum": ["deterministic", "pyodide", "manual-rubric"] },
        "activityType": {
          "enum": [
            "numeric", "single-choice", "vector", "algebraic-expression",
            "python-code", "short-rationale", "parsons", "code-trace", "predict-output",
            "multiple-choice", "diagnostic-rationale", "worked-example-fading", "scene-build"
          ]
        }
      }
    },
    "case": {
      "type": "object",
      "additionalProperties": false,
      "required": ["caseId", "difficultyProfile", "masteryEligible", "sourceLineage"],
      "properties": {
        "caseId": { "type": "string", "pattern": "^[a-z][a-z0-9]*(-[a-z0-9]+)*$" },
        "difficultyProfile": { "enum": ["intro", "core", "stretch", "challenge"] },
        "masteryEligible": { "type": "boolean" },
        "challengeEligible": { "type": "boolean", "default": false },
        "title": { "type": "string", "minLength": 1 },
        "sourceLineage": { "type": "array", "items": { "type": "string" }, "uniqueItems": true },
        "competencyIds": { "type": "array", "minItems": 1, "uniqueItems": true, "items": { "type": "string" } },
        "parameters": { "type": "object" },
        "expected": { "type": "object" },
        "choices": { "type": "array" },
        "prompt": { "type": "string" },
        "fullSolution": { "type": "string" },
        "hints": { "type": "array" },
        "variants": {
          "type": "array",
          "minItems": 1,
          "items": {
            "type": "object",
            "additionalProperties": false,
            "properties": {
              "parameters": { "type": "object" },
              "expected": { "type": "object" },
              "choices": { "type": "array" },
              "prompt": { "type": "string" },
              "fullSolution": { "type": "string" },
              "hints": { "type": "array" },
              "feedbackRules": {
                "type": "array",
                "items": { "$ref": "#/$defs/feedbackRule" }
              }
            }
          }
        },
        "feedbackRules": {
          "type": "array",
          "items": { "$ref": "#/$defs/feedbackRule" }
        },
        "statementPool": {
          "type": "object",
          "additionalProperties": false,
          "required": ["count", "correctRange", "statements"],
          "properties": {
            "count": { "type": "integer", "minimum": 2, "maximum": 6 },
            "correctRange": {
              "type": "array",
              "minItems": 2,
              "maxItems": 2,
              "items": { "type": "integer", "minimum": 1 }
            },
            "hints": { "type": "array" },
            "statements": {
              "type": "array",
              "minItems": 2,
              "items": { "$ref": "#/$defs/poolStatement" }
            }
          }
        },
        "typicalErrors": {
          "type": "array",
          "items": { "$ref": "#/$defs/typicalError" }
        },
        "activityType": {
          "enum": [
            "numeric", "single-choice", "vector", "algebraic-expression",
            "python-code", "short-rationale", "parsons", "code-trace", "predict-output",
            "multiple-choice", "diagnostic-rationale", "worked-example-fading", "scene-build"
          ]
        },
        "graderId": { "enum": ["deterministic", "pyodide", "manual-rubric"] },
        "traceTable": {},
        "rubric": {},
        "starterCode": { "type": "string" },
        "referenceSolver": { "type": ["string", "object"] },
        "tests": { "type": "array" },
        "packages": { "type": "array" },
        "fragments": { "type": "array" },
        "initialOrder": { "type": "array" },
        "solutionOrder": { "type": "array" },
        "distractors": { "type": "array" },
        "snippet": { "type": "string" },
        "output": { "type": "string" }
      },
      "not": {
        "properties": { "variants": true, "statementPool": true },
        "required": ["variants", "statementPool"]
      }
    },
    "feedbackRule": {
      "type": "object",
      "additionalProperties": false,
      "required": ["if", "then"],
      "properties": {
        "if": { "type": "string", "minLength": 1 },
        "then": { "type": "string", "minLength": 1 },
        "misconception": { "type": "string", "pattern": "^[a-z][a-z0-9]*(-[a-z0-9]+)*$" }
      }
    },
    "typicalError": {
      "type": "object",
      "additionalProperties": false,
      "required": ["id", "text"],
      "properties": {
        "id": { "type": "string", "pattern": "^[a-z][a-z0-9]*(-[a-z0-9]+)*$" },
        "text": { "type": "string", "minLength": 1 }
      }
    },
    "poolStatement": {
      "type": "object",
      "additionalProperties": false,
      "required": ["text", "correct", "feedback"],
      "properties": {
        "text": { "type": "string", "minLength": 1 },
        "correct": { "type": "boolean" },
        "feedback": { "type": "string", "minLength": 1 },
        "misconception": { "type": "string", "pattern": "^[a-z][a-z0-9]*(-[a-z0-9]+)*$" }
      }
    }
  }
}
