{
  "schemaVersion": 1,
  "familyId": "reproduce-canonical-hash-verify",
  "contract": null,
  "cases": [
    {
      "caseId": "canonical-hash-verify",
      "title": "Golden Set hashen und prüfen",
      "difficultyProfile": "core",
      "masteryEligible": true,
      "sourceLineage": [
        "w34-e4"
      ],
      "parameters": {
        "packages": [],
        "starterCode": "import hashlib\nimport json\n\n\ndef build_golden(items):\n    \"\"\"{'n': .., 'ids': .., 'sha256': ..} mit kanonischer Serialisierung und sha256 darueber.\"\"\"\n    ...\n\n",
        "tests": "GOLDEN = [\n    {\"id\": \"faq-03\", \"antwort\": \"Die Lieferzeit betraegt 3 Werktage.\", \"quellen\": [\"faq-3\"]},\n    {\"id\": \"faq-11\", \"antwort\": \"Die Frist endet nach 30 Tagen.\", \"quellen\": [\"vertrag-1\"]},\n    {\"id\": \"vertrag-02\", \"antwort\": \"Der Vertrag laeuft 12 Monate.\", \"quellen\": [\"vertrag-1\"]},\n]\na = build_golden(GOLDEN)\nb = build_golden(list(reversed(GOLDEN)))\n__check('anzahl und ids', a[\"n\"] == 3 and a[\"ids\"] == [\"faq-03\", \"faq-11\", \"vertrag-02\"])\n__check('reihenfolge-invarianz', a == b)\nveraendert = [dict(GOLDEN[0]), dict(GOLDEN[1]), dict(GOLDEN[2])]\nveraendert[1] = dict(GOLDEN[1])\nveraendert[1][\"antwort\"] = \"Die Frist endet nach 14 Tagen.\"\n__check('aenderungssensitiv', build_golden(veraendert)[\"sha256\"] != a[\"sha256\"])\n__check('exakter hash', a[\"sha256\"] == \"ef6c223d1f4463f5f34a57685240c39a6bf79a9957cd2bf9b05734ad19eaa312\")\n__check('leeres set', build_golden([]) == {\"n\": 0, \"ids\": [], \"sha256\": hashlib.sha256(\"[]\".encode(\"utf-8\")).hexdigest()})\nprint(\"ok w34-e4\")"
      },
      "competencyIds": [
        "c-research-capstone",
        "c-python-functions"
      ],
      "expected": {
        "kind": "reference-solver",
        "referenceSolver": "import hashlib\nimport json\n\n\ndef build_golden(items):\n    kanonisch = json.dumps(sorted(items, key=lambda e: e[\"id\"]), sort_keys=True, ensure_ascii=False, separators=(\",\", \":\"))\n    return {\"n\": len(items), \"ids\": sorted(e[\"id\"] for e in items), \"sha256\": hashlib.sha256(kanonisch.encode(\"utf-8\")).hexdigest()}"
      },
      "prompt": "Implementiere das gehashte Golden Set. <code>build_golden(items)</code> erhält eine Liste von Einträgen mit <code>id</code> und weiteren Feldern (z. B. antwort, quellen). Kanonische Serialisierung: <code>json.dumps(sorted(items, key=lambda e: e[\"id\"]), sort_keys=True, ensure_ascii=False, separators=(\",\", \":\"))</code>; der sha256-Hash wird über die UTF-8-Bytes dieser Serialisierung gebildet. Rückgabe: <code>{\"n\": anzahl, \"ids\": sortierte ids, \"sha256\": hexdigest}</code>. Der Testcode bringt ein Golden Set mit und prüft Reihenfolge-Invarianz, Änderungssensitivität und den exakten Hash.",
      "fullSolution": "<pre><code>import hashlib\nimport json\n\n\ndef build_golden(items):\n    kanonisch = json.dumps(sorted(items, key=lambda e: e[\"id\"]), sort_keys=True, ensure_ascii=False, separators=(\",\", \":\"))\n    return {\"n\": len(items), \"ids\": sorted(e[\"id\"] for e in items), \"sha256\": hashlib.sha256(kanonisch.encode(\"utf-8\")).hexdigest()}\n\n# exakter Fixture-Hash ef6c223d…eaa312; reversed() aendert ihn nicht, eine andere Gold-Antwort schon (lokal python3-verifiziert)</code></pre>",
      "hints": [
        "Erst sortieren (nach id), dann json.dumps mit sort_keys=True, ensure_ascii=False und kompakten Trennzeichen — genau diese Parameter machen die Serialisierung kanonisch.",
        "Der Digest läuft über kanonisch.encode(\"utf-8\"); ids und n kommen aus denselben Daten, nicht aus dem Hash."
      ],
      "typicalErrors": [
        {
          "id": "eingabereihenfolge-nicht-wegkanonisiert",
          "text": "Eingabereihenfolge nicht wegkanonisiert"
        },
        {
          "id": "json-dumps-parameter-vergessen-ensure",
          "text": "json.dumps-Parameter vergessen (ensure_ascii, separators)"
        },
        {
          "id": "ueber-etwas-anderes-als-die",
          "text": "über etwas anderes als die Serialisierung gehasht"
        }
      ],
      "activityType": "python-code",
      "graderId": "pyodide"
    }
  ]
}
